,job_title,company,location,salary,summary,link
8,"Data Scientist, Analytics, Intern",Facebook,"New York, NY 10017 (Midtown area)",,"Facebook's mission is to give people the power to build community and bring the world closer together. Through our family of apps and services, we're building a different kind of company that connects billions of people around the world, gives them ways to share what matters most to them, and helps bring people closer together. Whether we're creating new products or helping a small business expand its reach, people at Facebook are builders at heart. Our global teams are constantly iterating, solving problems, and working together to empower people around the world to build community and connect in meaningful ways. Together, we can help people build stronger communities — we're just getting started.
Are you passionate about Facebook’s product, analytics and technology? The Analytics team is looking for fast-moving analytics candidates and data junkies who want to make an impact. Candidates will help own analytics for a particular product or business at Facebook and work with product managers and engineers to translate the analysis into meaningful impact to the business. Please note that candidates will have a general interview and then we will make a determination of actual team assignments.
RESPONSIBILITIES
Perform large-scale data analysis to extract useful business insights
Identify actionable insights, suggest recommendations and influence the direction of the business by communicating results to cross-functional groups
Work closely with a Product Manager and Engineering team to proactively create rule and manage decisions
Classify leads so that the teams work on the most valuable cases
Suggest improvements in the tools and techniques to help scale the team
MINIMUM QUALIFICATIONS
Currently has, or is in the process of obtaining, a Bachelors, Masters or PhD degree in Computer Science, Applied Mathematics, Statistics, Economics, or related technical field
Experience in solving analytical problems using quantitative approaches (or equivalent)
Experience with SQL or other programming languages (Python, Java, and/or C++)
Development experience in at least one scripting language (PHP, Perl, Python, etc.)
Must obtain work authorization in country of employment at the time of hire, and maintain ongoing work authorization during employment
PREFERRED QUALIFICATIONS
Intent to return to degree-program after the completion of the internship
Curious, self-driven, analytical and excited to play with data
Ability to thrive in a fast paced work environment
Facebook is committed to providing reasonable accommodations for qualified individuals with disabilities and disabled veterans in our job application procedures. If you need assistance or an accommodation due to a disability, you may contact us at accommodations-ext@fb.com.",https://indeed.com//rc/clk?jk=1eb7e96ae99c871d&fccid=1639254ea84748b5&vjs=3
9,Data Scientist,National Debt Relief,"New York, NY 10004 (Financial District area)",,"Who We’re Looking For:
National Debt Relief (NDR) is currently seeking an inquisitive, highly motivated, and creative Data Scientist who is passionate about helping customers get out of debt. The ideal candidate will have hands on experience transforming unique data into amazing products. At scale.

At NDR you will have access to an enormous amount of high-value business activity data including unstructured and semi-structured records around the sales process as well as post sales customer activity. You will participate in the end-to-end processes of machine learning, from proof of concept to deploying models in production. You will be asked to experiment, and conduct research work geared towards new product development.
Principle Duties & Responsibilities:Work with large, complex datasets and solve difficult, non-routine analysis problems, applying advanced analytical methods as needed. Conduct end-to-end analysis that includes data gathering and requirements specification, data processing, analysis, and deployment to production.Research and develop models to improve the quality of NDR user facing products; example application areas include lead scoring and end-user behavioral modeling.Make business recommendations with effective presentations of findings at multiple levels of the business through visual displays of quantitative information.Develop processes and tools to monitor and analyze model performance and accuracyInteract cross-functionally with a wide variety of leaders and teams and work closely with Engineers and Product Managers to identify opportunities for improvement.Be fiercely competitive and maintain a sense of urgency, creativity, and curiosity for how to continue to improve internal and customer facing processes.
Qualifications:BA/BS in a quantitative discipline (Computer Science, Statistics, Bioinformatics, Math, Physics, Engineering) or an equivalent practical skillset.Industry experience writing code (e.g., Python, Pytorch, SQL) and taking ML models/ algorithms to production.3+ years of expertise using advanced machine learning algorithms and statistics: clustering, decision tree learning, ensemble methods, regression, etc. on large data sets as well as a strong understanding of their real-world advantages/drawbacks. The successful candidate will have regularly used Python and SQL to extract data, design ETL flows and derive insights.A love for data - this is what we do. We are looking for people who are excited about different and unique data sets, and all the ways that they could be used to improve our business.Demonstrated skill in selecting the right statistical tools given a data analysis problem.Excellent written and verbal communication skills for coordinating across teamsStartup experience while not essential is preferred.
What We Offer:
We believe in a team-first culture, full of rewards and recognition for our employees. We are dedicated to our employees’ success and growth within the company, through our employee mentorship and leadership programs.
Our extensive benefits package includes:
Generous Medical, Dental, and Vision Benefits
401(k) with Company Match
Paid Holidays, Volunteer Time Off, Sick Days, and Vacation
10 weeks Paid Parental Leave
Pre-tax Transit Benefits
Discounted Gym Membership
Citi Bike Annual Membership Discounts
No-Cost Life Insurance Benefits
Voluntary Benefits Options
ASPCA Pet Health Insurance Discount
About National Debt Relief:
National Debt Relief is one of the country’s largest and most reputable debt settlement companies. We are made up of energetic, smart, and compassionate individuals who are passionate about helping thousands of Americans with debt relief. Most importantly, we’re all about helping our customers through a tough financial time in their lives with education and individual customer service.
We are dedicated to helping individuals and families rid their lives of burdensome debt. We specialize in debt settlement and have negotiated settlements for thousands of creditor and collections accounts. We provide our clients with both our expertise and our proven results. This means helping consumers in their time of hardship to get out of debt with the least possible cost. It can also mean conducting financial consultations, educating the consumer, and recommending the appropriate solution. Our core services offer debt settlement as an alternative to bankruptcy, credit counseling, and debt consolidation. We become our clients' number one advocate to help them reestablish financial stability as quickly as possible.
National Debt Relief is a certified Great Place to Work®!
National Debt Relief is an equal opportunity employer and makes employment decisions without regard to race, color, religion, sex, sexual orientation, gender identity, national origin, protected veteran status, disability status, or any other status protected by law.",https://indeed.com//rc/clk?jk=bfdbc9e51b1e2f04&fccid=27ddc4a519a697f9&vjs=3
